{
  "$schema": "https://json-schema.org/draft/2020-12/schema",
  "type": "object", "additionalProperties": false,
  "required": ["schemaVersion", "evidenceId", "taskId", "candidateId", "candidateCommit", "positioning", "resolvedRuleSet", "caseId", "caseHash", "oracleHash", "inputHash", "checkpointSetSha256", "executionPlanSha256", "checkpointIds", "executor", "observation", "adapter", "capabilitiesObserved", "adapterInvocation", "command", "startedAt", "finishedAt", "exitCode", "counters", "transcript", "artifacts", "result"],
  "properties": {
    "schemaVersion": {"const": "4.0"}, "evidenceId": {"type": "string"}, "taskId": {"type": "string"}, "candidateId": {"type": "string"},
    "candidateCommit": {"type": "string", "pattern": "^[0-9a-f]{40}$"}, "positioning": {"$ref": "#/$defs/ref"}, "resolvedRuleSet": {"$ref": "#/$defs/ref"},
    "caseId": {"type": "string"}, "caseHash": {"type": "string", "pattern": "^[0-9a-f]{64}$"}, "oracleHash": {"type": "string", "pattern": "^[0-9a-f]{64}$"}, "inputHash": {"type": "string", "pattern": "^[0-9a-f]{64}$"},
    "checkpointSetSha256": {"type": "string", "pattern": "^[0-9a-f]{64}$"}, "executionPlanSha256": {"type": "string", "pattern": "^[0-9a-f]{64}$"},
    "checkpointIds": {"type": "array", "minItems": 1, "uniqueItems": true, "items": {"type": "string", "pattern": "^CP-[A-Z0-9][A-Z0-9._-]*$"}},
    "executor": {"type": "object"}, "observation": {"enum": ["runtime-observed", "blackbox-observed", "derived", "declared"]},
    "adapter": {"type": "object", "additionalProperties": false, "required": ["id", "version", "sha256"], "properties": {"id": {"type": "string"}, "version": {"type": "string"}, "sha256": {"type": "string", "pattern": "^[0-9a-f]{64}$"}}},
    "capabilitiesObserved": {"type": "array", "uniqueItems": true, "items": {"type": "string"}}, "adapterInvocation": {"$ref": "#/$defs/ref"}, "externalTranscript": {"$ref": "#/$defs/ref"},
    "toolVersion": {"type": "string"}, "operation": {"type": "string"}, "command": {"type": "array", "items": {"type": "string"}},
    "startedAt": {"type": "string", "format": "date-time"}, "finishedAt": {"type": "string", "format": "date-time"}, "exitCode": {"type": "integer"}, "counters": {"type": "object"},
    "transcript": {"$ref": "#/$defs/ref"}, "artifacts": {"type": "array", "items": {"$ref": "#/$defs/ref"}}, "result": {"enum": ["PASS", "FAIL", "BLOCKED"]}
  },
  "$defs": {"ref": {"type": "object", "additionalProperties": false, "required": ["path", "bytes", "sha256", "tracked"], "properties": {"path": {"type": "string"}, "bytes": {"type": "integer", "minimum": 0}, "sha256": {"type": "string", "pattern": "^[0-9a-f]{64}$"}, "tracked": {"const": true}}}}
}
