{
  "schemaVersion": "4.0",
  "evidenceId": "EVIDENCE-001",
  "taskId": "TASK-001",
  "candidateId": "replace-with-candidate-id",
  "candidateCommit": "replace-with-40-char-commit",
  "positioning": {"path": ".vibe-control/project-positioning.json", "bytes": 0, "sha256": "replace-with-64-char-sha256", "tracked": true},
  "resolvedRuleSet": {"path": ".vibe-control/resolved-rule-set.json", "bytes": 0, "sha256": "replace-with-64-char-sha256", "tracked": true},
  "caseId": "CASE-001",
  "caseHash": "replace-with-64-char-sha256",
  "oracleHash": "replace-with-64-char-sha256",
  "inputHash": "replace-with-64-char-sha256",
  "checkpointSetSha256": "replace-with-64-char-sha256",
  "executionPlanSha256": "replace-with-64-char-sha256",
  "checkpointIds": ["CP-001"],
  "executor": {"actorId": "executor", "sessionId": "session-id"},
  "observation": "runtime-observed",
  "adapter": {"id": "generic-command", "version": "1.0.0", "sha256": "replace-with-64-char-sha256"},
  "capabilitiesObserved": [],
  "adapterInvocation": {"path": ".vibe-control/evidence/adapter-invocation.json", "bytes": 0, "sha256": "replace-with-64-char-sha256", "tracked": true},
  "command": ["replace-with-command"],
  "startedAt": "replace-with-iso-time",
  "finishedAt": "replace-with-iso-time",
  "exitCode": 1,
  "counters": {"executed": 0, "passed": 0, "failed": 0, "skipped": 0},
  "transcript": {"path": ".vibe-control/evidence/transcript.txt", "bytes": 0, "sha256": "replace-with-64-char-sha256", "tracked": true},
  "artifacts": [],
  "result": "BLOCKED"
}
